qid	query
1185869	)what was the immediate impact of the success of the manhattan project?
1185868	_________ justice is designed to repair the harm to victim, the community and the offender caused by the offender criminal act. question 19 options:
597651	what color is amber urine
403613	is autoimmune hepatitis a bile acid synthesis disorder
1183785	elegxo meaning
312651	how much does an average person make for tutoring
80385	can you use a calculator on the compass test
645590	what does physical medicine do
645337	what does pending mean on listing
186154	feeding rice cereal how many times per day
457407	most dependable affordable cars
441383	lithophile definition
683408	what is a flail chest
1164799	what causes ear infection in adults
484187	put yourself on child support in texas
460668	mushrooms health benefits
666321	what happens in a wrist sprain
182487	example of culture &sensitivity results
564233	what are rhetorical topics
455279	mode of acquisition
208108	how beautiful on the mountain are the feet
733739	what is considered early fall
1164798	what causes elevated nitrate levels in aquariums
402608	is an independent contractor hired by a company entitled to the same non-compete as a normal employee
443797	lyme disease symptoms mood
662502	what forms the epineurium
1184679	an alpha helix is an example of which protein structure?
14562	aggregate demand curve
602162	what county is ackley iowa in
545059	weather in medellin, colombia
708236	what is adiabatic?
310130	how much does a lipid panel cost
693161	what is a nrr noise reduction rating mean
186617	fibroid symptoms after menopause
573027	what are the requirements for neurologist
1173772	meaning of ..bann..
541973	watts & browning engineers
273090	how long was jack denison dorothy dandridge married
441269	literal define
642237	what does lease to purchase on car mean?
503515	steering define
637443	what does fb mean on a ring
1164796	what causes elevation in ast (sgot)
749988	what is garlic used for
749988	what is garlic used for
135841	definition of legal term injunctive relief
295446	how many seconds should check for breathing
653051	what does the term bar none mean
691147	what is a mini whoodle
410621	is frida kahlo mexican
410621	is frida kahlo mexican
1164795	what causes everything to taste sugary
598443	what color is venus planet
596451	what class lever is a nutcracker
651441	what does the name halima mean
452286	meds that can cause irregular heartbeat
308543	how much does a ballet dancer make
202126	highest enlisted marine female
114820	cyrillic alphabet definition
501778	spousal roth ira contribution after age 70
531029	typical retirement fers
651110	what does the name asia mean
594127	what cell type is responsible for producing current?
1164794	what causes excel file corruption
396032	infrax system
705580	what is a virtual interface
658203	what ethnicity is darren criss' mom?
387734	how was the esperanza fire started
655102	what does whistling dixie mean
224712	how does a bump key work
411732	is gwen stefani italian
1164793	what causes exhaust hanger to fail
605902	what county is fine ny in
581014	what can cause a metallic smell
559240	what are garlic supplements good for
608711	what county is lochbuie co in
535936	vde definition
130335	definition chemical
147535	difference between hep b and c
1164792	what causes extreme swelling in just one leg?
595576	what citation is used for outside sources
569308	what are the drugs used for moderate sedation
753706	what is hardie plank
627871	what does ISF mean fluid do
673608	what is a affidavit of support
510071	syracuse minor league baseball
113839	current fuel price in delhi
1164791	what causes eyelid itching and swelling
460953	myers-briggs personality test what do the letters stand for
685235	what is a good home remedy for hemorrhoids
650643	what does the last name spratt mean
1183784	element al
1164790	what causes feelings of detachment from reality,
96740	concrete walkway cost per square foot
26666	armistead meaning
490046	ross cameron age
485823	reasons why nuclear power is bad
635632	what does dealer invoice price mean
534505	use pi as wired vpn router
498612	singular noun definition for kids
85453	causes of back pain in female for a week
493122	savannah georgia average yearly weather
512836	temperature sorrento italy september
605764	what county is exeter nh
748182	what is fms medical term
725274	what is boot screening?
401461	is acre capitalized
499565	smoking patches how long should you be on them
641186	what does it mean when the bottom of your foot is really hot
468434	oliguric meaning
31086	average annual snowfall in jersey
480268	price for hardwood floor refinishing
742160	what is e. pluribus unum
305154	how much do club set bottles cost?
1164787	what causes film creasing during folding process
688661	what is a lease?
1173771	meaning of a discrete concept
535243	va choice provider phone number
535243	va choice provider phone number
477240	population nehalem or
321187	how much is a pint of patron
755409	what is home systems protection insurance
553140	what all is ferric gluconate used for
88585	causes of swollen ankles and feet
88585	causes of swollen ankles and feet
88585	causes of swollen ankles and feet
416278	is levaquin an antibiotic
652801	what does the sphinx represent
448861	meaning of obtunded
609117	what county is marlboro, nj
508975	symptoms of tularemia in rabbits
686474	what is a health unit coordinator
1164784	what causes flashes of light in your peripheral vision?
390443	ibm filenet discovery
342332	how to abbreviate degrees fahrenheit
396120	inherent legal definition
82631	carbs withdrawal signs and symptoms
430171	is turmeric curcumin
422799	is rosemary oil good for back pain?
564701	what are setbacks in zoning
677722	what is a cleric
659630	what files do dvd players read
396846	integrated dna technology
667478	what happens when waves hit a concave surface
165324	does dehydration cause sleep harder
118	(Metformin what is it and what does it do?)
531802	unconscious bias definition
457773	most expensive places in the world dublin
1164782	what causes fluid in the ears?
1164782	what causes fluid in the ears?
1164782	what causes fluid in the ears?
650692	what does the legal term demur mean?
622007	what do architectural drawings show
492528	salt water aquarium salinity
642101	what does lactose do
481431	prices for massages
481431	prices for massages
296072	how many species go extinct in an average day
296072	how many species go extinct in an average day
711452	what is an alias name
608452	what county is lawton, ok
476121	pluvious definition
451572	medicare prior authorization number for florida
170935	does restrictive lung disease cause sleep apnea
212020	how common is the name andrew?
756195	what is human trafficking
321944	how much is does it cost to insure a house
626785	what do you need to be certified in medical coding
398567	irs continuing education requirements
398567	irs continuing education requirements
499488	smart procurement definition
522059	to_date function
617436	what degree  is ideal flag mount
17008	amnesty define
510363	talk stoop cat what happened to bulldog gracie
311755	how much does a teaching assistant earn
320624	how much is Welding school
520990	time hawaii
344949	how to become a class b cdl driver
670628	what includes in nursing general survey
670628	what includes in nursing general survey
620254	what did the nuremberg trials do explanation
561453	what are mangroves
716682	what is an open system server
306728	how much do pediatric nurse practioners make a year
448235	meaning of material requisition
696473	what is a prostate rub
476888	population brigham city utah
480096	price clips
511086	team uniform color schemes
1164777	what causes gall bladder infection
1164777	what causes gall bladder infection
538223	volcano hawaii stats
173769	does vinegar help poison ivy
427099	is the pill nabumetone a narcotic
508811	symptoms of strep throat for an adult
391495	if i contribute to a roth ira is it taxable
576864	what are voles?
292137	how many people died at the battle of gettysburg
588376	what causes hair to break
588376	what causes hair to break
588376	what causes hair to break
1164776	what causes gall bladder infections?
1173770	meaning of a navigate
630360	what does a spider bute sore look like
406188	is china bigger than the united states
576138	what are trap cards
617804	what degree sunburn causes blisters
30619	average age of nhl teams
574110	what are the symptoms of a bad O2 sensor
574702	what are the three major groups of protists
316639	how much does it cost to replace a foundation of a house?
751529	what is glycohemoglobin
502248	stalactites definition
502248	stalactites definition
486399	redemption cast
708195	what is adh
116736	defense base act chubb
559956	what are hereditary traits
360382	how to freeze fresh beet greens
574325	what are the symptoms of scabies
1164772	what causes gout in ankles?
515331	the definition of the word civilization
418844	is mystique a hero or villain
290590	how many of methane is released by cows
726424	what is buprenorphine taken for?
1184764	derivation of roe name
433744	kahley meaning
671399	what instrument is used to measure humidity
651938	what does the name rin mean
746395	what is fascial stretch therapy
280775	how many days are in a school year in texas
437723	lasagna meaning
545859	weather in santorini in august
545859	weather in santorini in august
742685	what is eden lake
591348	what causes rust on iron
697504	what is a receptionist
24388	are poppies grown from seed or bulb
596155	what city is sjo in costa rica
707182	what is abstract noun for rich
649051	what does tax mean
759231	what is inhibitors
1183782	anthracite highest
468728	on what date is the solar eclipse this year
453298	miana name meaning
460001	movie , how he invented things
502926	stat means
661940	what foods to avoid if you have burning mouth syndrome
661940	what foods to avoid if you have burning mouth syndrome
242169	how long can i stay in cambodia
675962	what is a butterfly needle
575787	what are three branches of government
459088	most quoted writer in english language
1164764	what causes headache at back of head and behind eyes
624575	what do rabbits eat in the wild
138829	definition of the word conjure
431504	is windows defender good enough
691516	what is a mood disorder
11653	adjustable mortgage loans definition
11653	adjustable mortgage loans definition
423287	is sclera a layer of the eye
1173769	8 days after conception symptoms
1164761	what causes heterochromia eyes and
583734	what cause chest pains
448621	meaning of name merin
608955	what county is macungie, pa in
744373	what is epidemiology pdf
287532	how many leadership characteristics
624752	what do scientists classify as a air masses according to
396288	inorganic nutrients definition
683242	what is a financier dessert
1164759	can threadworms cause appendicitis
189935	foods to avoid in gallbladder disease
189935	foods to avoid in gallbladder disease
189935	foods to avoid in gallbladder disease
690255	what is a mastic
593603	what causes white tongue coating
445857	masseter definition
193384	gas octane ratings
656174	what duration should you change your refrigerator water filter
395608	industry day navy
1164758	what causes hives and itching
449132	meaning of samoset
15252	alcohol disinfect
565659	what are some of the main causes of deforestation in amazon rainforest
482806	promulgates definition
705802	what is a vulnerability scanner
663380	what generation is keflex
1174666	is waiver of subrogation on gl or property
252674	how long does it take epoxy floor to cure
541895	waterloo war
441367	liters measures what
512638	temperature of meatloaf when it's done
616319	what date is jefferson tx mardi gras
308679	how much does a brachioplasty cost
500192	soleil meaning
5202	NAD / NADH definition
610542	what county is nyc
465276	normal body temperature range for toddlers
