qid	query	label	did	docs
2193527	can you still sign up to vote	Factual	['D2997793', 'D3325141']	Factual: https//secure.utah.gov/voterreg/index.html welcome to the utah voter registration website home welcome to the utah voter registration website register to vote update voter information vote by mail regarding address updates in order to register online to vote  your address must match the address on file with the driver license division. if your driver license address is not current  please update your address with the driver license division. this must be done before submitting your online voter registration. update your driver license after updating your address please allow 24 hours before returning to register to vote online. if your address is not current with dld you may still use the online voter registration system  but you will be required to print the voter form with the correct address  sign it and mail it in. https//www.vote.org/voter-registration-deadlines/ voter registration deadlines voter registration deadlines state voter registration deadlines election day registration alabama in-person 15 days before election day by mail 15 days before election day online 15 days before election day n/aalaska in-person 30 days before election day. by mail postmarked 30 days before election day. if this falls on a sunday  your voter registration form must be postmarked 31 days before election day. online 30 days before election day. n/aarizona in-person 29 days before election day. by mail 29 days before election day. online 29 days before election day n/aarkansas in-person 30 days before election day. by mail 30 days before election day. if this falls on a sunday then your voter registration form must be postmarked 29 days before election day. online n/an/acalifornia in-person 15 days before election day. by mail 15 days before election day. online 15 days before election day. n/acolorado in-person election day. by mail received 8 days before election day. online 8 days before election day. you can register and cast a ballot after the official deadline by appearing in-person at a voter service and polling center during the early voting period or on election day. contact your local election office if you have any questions. connecticut in-person 7 days before election day. by mail 14 days before election day. online 7 days before election day. if the voter registration deadline has passed  you can still register to vote in person at the office of your local election office at any point until election day. contact your local election office if you have any questions. delaware in-person 24 days before a primary or general election. 10 days before a special election. by mail 24 days before a primary or general election. 10 days before a special election. online 24 days before a primary or general election. 10 days before a special election. n/adistrict of columbia in-person election day  with proof of residency. by mail 30 daysbefore election day. online 30 days before election day. if you have missed the voter registration deadline  you can still register to vote and a cast a ballot at the same time during early voting or on election day. simply go to your regular polling place or early voting site to register and vote. contact your local election office if you have any questions. florida in-person 29 days before election day. by mail 29 days before election day. online n/an/ageorgia in-person 29 days before election day by mail 28 days before election day online 30 days before election day n/ahawaii in-person 29 days before election day. by mail 29 days before election day. online 29 days before election day. if you have missed the voter registration deadline  you can still register to vote and a cast a ballot at the same time during early voting at early walk-in locations. contact your local election office if you have any questions. idaho in-person election day. by mail 25 days before election day. online n/aif you have missed the voter registration deadline  you can still register to vote and a cast a ballot at the same time during early voting or on election day. simply go to your regular polling place or early voting site to register and vote. contact your local election office if you have any questions. illinois in-person election day by mail 28 days before election day. online 28 days before election day. you can also register in person (and vote) at your local elections office during the grace period. the grace period starts 27 days before election day and ends on election day. grace period voting but this does not take place at your regular polling place. grace period voting almost always happens at your local election offices office. contact your local election office for more information. indiana in-person 29 days before election day. by mail 29 days before election day. online 29 days before election day. n/aiowa in-person 10 days before primary and general elections. 11 days before all other elections. if you miss these deadlines  you can also register to vote on election day. by mail postmarked 15 or more days before election day. online 10 days before election day. if you have missed the voter registration deadline  you can still register to vote and a cast a ballot at the same time during early voting or on election day. simply go to your regular polling place or early voting site to register and vote. contact your local election office if you have any questions. kansas in-person 21 days before election day by mail postmarked 21 days before election day online 21 days before election day. n/akentucky in-person 29 days before election day. by mail 29 days before election day. online n/an/alouisiana in-person 30 days before election day. by mail received 30 days before election day. if that day is a sunday  then the deadline is 29 days before election day. online 30 days before election day. n/amaine in-person election day. by mail delivered 21 business days before election day. online n/aif you have missed the voter registration deadline  you can still register to vote and a cast a ballot at the same time during early voting or on election day. to register under these rules  you must visit the office of your local election office before voting. contact your local election office with any questions. maryland in-person 21 days before election day or during early voting between 13 to 5 days before election day. by mail 21 days before election day. online 21 days before election day. you can register to vote in-person during early voting (october 27-november 3  2016). if you cant register by the close of voter registration (october 18  2016)  go to an early voting center in the county where you live and bring a document that proves where you live. this document can be your mva-issued license  id card  or change of address card  or your paycheck  bank statement  utility bill  or other government document with your name and new address. massachusetts in-person 20 days before election day. by mail 20 days before election day. online 20 days before election day. n/amichigan in-person 21 days before election day. by mail 30 days before election day. online n/an/aminnesota in-person election day by mail received 21 days before election day online 21 days before election day. if you have missed the voter registration deadline  you can still register to vote and a cast a ballot at the same time during the in-person absentee voting period or on election day. simply go to your regular in-person absentee voting site -- or to your regular polling place -- to register and vote. contact your local election office if you have any questions. mississippi in-person 30 days before election day. by mail 30 days before election day. online n/an/amissouri in-person 28 days before election day by mail 28 days before election day. online 28 days before election day n/amontana in-person election day by mail postmarked 30 days before election day. if this day is a sunday  then your form must be postmarked 29 days before election day. online n/aif you have missed the voter registration deadline  you can still register to vote and a cast a ballot at the same time during early voting or on election day. youll have to register at the office of your local election office -- not at a polling place. contact your local election office for questions about the process or identification requirements. nebraska in-person 11 days before election day. by mail 18 days before election day online 18 days before election day. n/anevada in-person 21 days before election day by mail 31 days before election day. online 21 days before election day n/anew hampshire in-person election day by mail received 10 days before election day. online n/aif you have missed the voter registration deadline  you can still register to vote and a cast a ballot at the same time on election day. simply go to your regular polling place or early voting site to register and vote. contact your local election office for questions about the process or identification requirements. new jersey in-person 21 days before election day. by mail 21 days before election day. online n/an/anew mexico in-person 28 days before election day. by mail 28 days before election day. online 28 days before election day. n/anew york in-person 25 days before election day. by mail 25 days before election day. online 25 days before election day. n/anorth carolina in-person 25 days before election day. by mail postmarked 25 days before election day. online n/an/anorth dakota in-person north dakota does not have voter registration by mail north dakota does not have voter registration online north dakota does not have voter registration north dakota does not have voter registration ohio in-person 30 days before election day. by mail 30 days before election day. online ??? n/aoklahoma in-person 25 days before election day. by mail 25 daysbefore election day. online n/an/aoregon in-person 21 days before election day. by mail 21 days before election day. online 21 days before election day. n/apennsylvania in-person 30 days before election day by mail 30 days before election day online 30 days before election day n/arhode island in-person 30 days before most elections. you may register in person on election day but only for presidential elections by mail 30 daysbefore election day. online n/arhode island general law 17-1-3 allows an individual who has missed the voter registration deadline to register and vote for president/vice-president only at their local board of canvassers on election day. this is only applicable for elections in which the office of president of the united states in on the ballot. south carolina in-person 30 days before election day. by mail 30 days before election day. online 30 days before election day. n/asouth dakota in-person 15 days before election day. by mail received 15 days before election day. online n/an/atennessee in-person 30 days before election day. by mail 30 days before election day. online n/an/atexas in-person 30 days before election day. by mail 30 days before election day. online n/an/autah in-person 7 days before election day. by mail 30 days before election day. online 7 days before election day. n/avermont in-person 6 days before election day by mail received 6 days before election day online 6 days before election day n/avirginia in-person 22 days before election day. by mail received 22 days before election day. online 22 days before election day. n/awashington in-person 8 days before election day. by mail 29 days before election day. online 29 days before election day. n/awest virginia in-person 21 days before election day. by mail 21 days before election day. online 21 days before election day. n/awisconsin in-person election day by mail postmarked at least 20 days before election day. online n/aif the voter registration deadline has passed  you can still register to vote in person at the office of your local election office at any time up to election day. wyoming in-person election day by mail received 14 days before election day. online n/aif you have missed the voter registration deadline  you can still register to vote and a cast a ballot at the same time during early voting or on election day. simply go to your regular polling place or early voting site to register and vote. contact your local election office for questions about the process or identification requirements. 
3512385	link united healthcare provider login	Navigational	['D160685', 'D1906390']	Navigational: https//www.unitedhealthcareonline.com/b2c/cmaaction.do?viewkey=preloginmain&forwardtoken=preloginmain . link self service tools bring value to care providers by increasing productivity  providing superior documentation  and reducing costs associated with paper processes. learn more about bringing the power of self service to your team!news streamline your workflow with our prior authorization and notification app04/03/2018april 2018 edition of the medical policy update bulletin now available04/01/2018april 2018 network bulletin03/30/2018user id & password management will become link security03/27/2018availity website will stop displaying united healthcare information on march 28  201803/23/2018march 2018 edition of the medical policy update bulletin now available03/01/2018march 2018 network bulletin03/01/2018view more >>register for network bulletin >>in the spotlight quick links access your patient care opportunity report electronic payments and statements health reform resources icd-10 and regulatory outreach network bulletin policies  protocols and administrative guides training & education united health premium security notice privacy policy site use agreement site map united healthcare.com copyright © 2015 united health group  incorporated. all rights reserved. https//provider.linkhealth.com/ welcome to link welcome to link introducing link - an intuitive  self-service experience for care providers and their staff that improves administrative workflow to make their work measurably faster and easier. with link  its easier than ever to get the right data to the right person at the right time to improve health care outcomes. sign in with optum iddont have an optum id? register need assistance? contact us
